{
  "schemaVersion": 1,
  "generatedAt": "2026-09-22T14:17:50.217Z",
  "source": {
    "name": "Retire.js",
    "url": "https://raw.githubusercontent.com/RetireJS/retire.js/master/repository/jsrepository-v4.json",
    "sha256": "eb0289a2b0cb7b1b61c39e30dc587db49d1901977eaabfa9c6dd28606ce30fd5",
    "license": "Apache-2.0",
    "notice": "Filtered and normalized by rustline.dev; explanations added. Upstream advisory identifiers, ranges and references retained."
  },
  "libraries": {
    "jquery": {
      "name": "jQuery",
      "npm": "jquery",
      "upstreamKey": "jquery",
      "coverage": "retire",
      "latest": "4.0.0",
      "releaseSource": "https://registry.npmjs.org/jquery/latest",
      "advisories": [
        {
          "id": "GHSA-579v-mp3v-rrw5",
          "aliases": [
            "CVE-2011-4969",
            "GHSA-579v-mp3v-rrw5"
          ],
          "kind": "vulnerability",
          "severity": "medium",
          "summary": "XSS with location.hash",
          "why": "If untrusted content reaches the affected feature, an attacker may run JavaScript in a visitor’s browser and act as that visitor.",
          "cwe": [
            "CWE-79"
          ],
          "applicability": "unspecified",
          "references": [
            "http://research.insecurelabs.org/jquery/test/",
            "https://bugs.jquery.com/ticket/9521",
            "https://nvd.nist.gov/vuln/detail/CVE-2011-4969"
          ],
          "ranges": [
            {
              "introduced": null,
              "fixed": "1.6.3"
            }
          ]
        },
        {
          "id": "GHSA-2pqj-h3vj-pqgw",
          "aliases": [
            "CVE-2012-6708",
            "GHSA-2pqj-h3vj-pqgw"
          ],
          "kind": "vulnerability",
          "severity": "medium",
          "summary": "Selector interpreted as HTML",
          "why": "If untrusted content reaches the affected feature, an attacker may run JavaScript in a visitor’s browser and act as that visitor.",
          "cwe": [
            "CWE-64",
            "CWE-79"
          ],
          "applicability": "unspecified",
          "references": [
            "http://bugs.jquery.com/ticket/11290",
            "http://research.insecurelabs.org/jquery/test/",
            "https://nvd.nist.gov/vuln/detail/CVE-2012-6708"
          ],
          "ranges": [
            {
              "introduced": null,
              "fixed": "1.9.0b1"
            }
          ]
        },
        {
          "id": "GHSA-q4m3-2j7h-f7xw",
          "aliases": [
            "CVE-2020-7656",
            "GHSA-q4m3-2j7h-f7xw"
          ],
          "kind": "vulnerability",
          "severity": "medium",
          "summary": "Versions of jQuery prior to 1.9.0 are vulnerable to Cross-Site Scripting (XSS). The load method fails to recognize and strip script tags containing whitespace in the closing tag (e.g. </script >), allowing enclosed script logic to execute and enabling attackers to run arbitrary JavaScript in a victim's browser.",
          "why": "If untrusted content reaches the affected feature, an attacker may run JavaScript in a visitor’s browser and act as that visitor.",
          "cwe": [
            "CWE-79"
          ],
          "applicability": "unspecified",
          "references": [
            "https://github.com/advisories/GHSA-q4m3-2j7h-f7xw",
            "https://nvd.nist.gov/vuln/detail/CVE-2020-7656",
            "https://research.insecurelabs.org/jquery/test/"
          ],
          "ranges": [
            {
              "introduced": "1.2.1",
              "fixed": "1.9.0"
            }
          ]
        },
        {
          "id": "GHSA-rmxg-73gg-4p98",
          "aliases": [
            "CVE-2015-9251",
            "GHSA-rmxg-73gg-4p98"
          ],
          "kind": "vulnerability",
          "severity": "medium",
          "summary": "3rd party CORS request may execute",
          "why": "If untrusted content reaches the affected feature, an attacker may run JavaScript in a visitor’s browser and act as that visitor.",
          "cwe": [
            "CWE-79"
          ],
          "applicability": "unspecified",
          "references": [
            "http://blog.jquery.com/2016/01/08/jquery-2-2-and-1-12-released/",
            "http://research.insecurelabs.org/jquery/test/",
            "https://github.com/advisories/GHSA-rmxg-73gg-4p98",
            "https://github.com/jquery/jquery/issues/2432",
            "https://nvd.nist.gov/vuln/detail/CVE-2015-9251"
          ],
          "ranges": [
            {
              "introduced": "1.4.0",
              "fixed": "1.12.0"
            },
            {
              "introduced": "1.12.3",
              "fixed": "3.0.0-beta1"
            }
          ]
        },
        {
          "id": "RETIRE-jquery-85057ed7a245",
          "aliases": [],
          "kind": "vulnerability",
          "severity": "medium",
          "summary": "parseHTML() executes scripts in event handlers",
          "why": "If untrusted content reaches the affected feature, an attacker may run JavaScript in a visitor’s browser and act as that visitor.",
          "cwe": [
            "CWE-79"
          ],
          "applicability": "unspecified",
          "references": [
            "http://research.insecurelabs.org/jquery/test/",
            "https://bugs.jquery.com/ticket/11974"
          ],
          "ranges": [
            {
              "introduced": "1.8.0",
              "fixed": "2.2.0"
            },
            {
              "introduced": "2.2.2",
              "fixed": "3.0.0"
            }
          ]
        },
        {
          "id": "RETIRE-jquery-73",
          "aliases": [],
          "kind": "maintenance",
          "severity": "low",
          "summary": "jQuery 1.x and 2.x are End-of-Life and no longer receiving security updates",
          "why": "This release no longer receives security fixes. Future problems may remain unpatched.",
          "cwe": [
            "CWE-1104"
          ],
          "applicability": "unspecified",
          "references": [
            "https://github.com/jquery/jquery.com/issues/162"
          ],
          "ranges": [
            {
              "introduced": null,
              "fixed": "2.999.999"
            }
          ]
        },
        {
          "id": "GHSA-mhpp-875w-9cpv",
          "aliases": [
            "CVE-2016-10707",
            "GHSA-mhpp-875w-9cpv"
          ],
          "kind": "vulnerability",
          "severity": "high",
          "summary": "Denial of Service in jquery",
          "why": "Crafted input can consume excessive resources or crash the affected application. The impact depends on the feature and runtime used.",
          "cwe": [
            "CWE-400",
            "CWE-674"
          ],
          "applicability": "unspecified",
          "references": [
            "https://nvd.nist.gov/vuln/detail/CVE-2016-10707"
          ],
          "ranges": [
            {
              "introduced": "3.0.0-rc.1",
              "fixed": "3.0.0"
            }
          ]
        },
        {
          "id": "GHSA-6c3j-c64m-qhgq",
          "aliases": [
            "CVE-2019-11358",
            "GHSA-6c3j-c64m-qhgq"
          ],
          "kind": "vulnerability",
          "severity": "medium",
          "summary": "jQuery before 3.4.0, as used in Drupal, Backdrop CMS, and other products, mishandles jQuery.extend(true, {}, ...) because of Object.prototype pollution",
          "why": "If untrusted content reaches the affected feature, an attacker may run JavaScript in a visitor’s browser and act as that visitor.",
          "cwe": [
            "CWE-1321",
            "CWE-79"
          ],
          "applicability": "unspecified",
          "references": [
            "https://blog.jquery.com/2019/04/10/jquery-3-4-0-released/",
            "https://github.com/jquery/jquery/commit/753d591aea698e57d6db58c9f722cd0808619b1b",
            "https://nvd.nist.gov/vuln/detail/CVE-2019-11358"
          ],
          "ranges": [
            {
              "introduced": "1.1.4",
              "fixed": "3.4.0"
            }
          ]
        },
        {
          "id": "GHSA-jpcq-cgw6-v4j6",
          "aliases": [
            "CVE-2020-11023",
            "GHSA-jpcq-cgw6-v4j6"
          ],
          "kind": "vulnerability",
          "severity": "medium",
          "summary": "passing HTML containing <option> elements from untrusted sources - even after sanitizing it - to one of jQuery's DOM manipulation methods (i.e. .html(), .append(), and others) may execute untrusted code.",
          "why": "If untrusted content reaches the affected feature, an attacker may run JavaScript in a visitor’s browser and act as that visitor.",
          "cwe": [
            "CWE-79"
          ],
          "applicability": "unspecified",
          "references": [
            "https://blog.jquery.com/2020/04/10/jquery-3-5-0-released/"
          ],
          "ranges": [
            {
              "introduced": "1.0.3",
              "fixed": "3.5.0"
            }
          ]
        },
        {
          "id": "GHSA-gxr4-xjj5-5px2",
          "aliases": [
            "CVE-2020-11022",
            "GHSA-gxr4-xjj5-5px2"
          ],
          "kind": "vulnerability",
          "severity": "medium",
          "summary": "Regex in its jQuery.htmlPrefilter sometimes may introduce XSS",
          "why": "If untrusted content reaches the affected feature, an attacker may run JavaScript in a visitor’s browser and act as that visitor.",
          "cwe": [
            "CWE-79"
          ],
          "applicability": "unspecified",
          "references": [
            "https://blog.jquery.com/2020/04/10/jquery-3-5-0-released/"
          ],
          "ranges": [
            {
              "introduced": "1.12.0",
              "fixed": "3.5.0"
            }
          ]
        }
      ]
    },
    "angularjs": {
      "name": "AngularJS",
      "npm": "angular",